<?xml version="1.0"?>
<?xml-stylesheet type="text/xsl" href="genre_schau.xslt"?>
<resultset statement="SELECT * FROM filmen WHERE genres LIKE '%Action%' AND schauspieler LIKE '%Arnold Schwarzenegger%' AND jahr &gt; 1990 AND jahr &lt; 2000
" xmlns:xsi="http://www.w3.org/2001/XMLSchema-instance" xsi:noNamespaceSchemaLocation="genre_schau.xsd">
  <row>
	<field name="id">40</field>
	<field name="titel">Terminator 2: Judgment Day</field>
	<field name="jahr">1991</field>
	<field name="laenge">137 min</field>
	<field name="genres">&quot;Action;Sci-Fi;Thriller&quot;</field>
	<field name="regisseure">&quot;James Cameron&quot;</field>
	<field name="schauspieler">&quot;Arnold Schwarzenegger;Edward Furlong;Linda Hamilton;Robert Patrick&quot;</field>
	<field name="plot">&quot;A cyborg, identical to the one who failed to kill Sarah Connor, must now protect her teenage son, John Connor, from a more advanced cyborg.&quot;</field>
	<field name="sprache">&quot;English;Spanish&quot;</field>
	<field name="laender">&quot;France;USA&quot;</field>
	<field name="plakat_url|">https://images-na.ssl-images-amazon.com/images/M/MV5BZDM2YjYwYWMtMWZlNi00ZDQxLWExMDctMDAzNzQ0OTkzZjljXkEyXkFqcGdeQXVyMTQxNzMzNDI@._V1_SX300.jpg</field>
	<field name="imdbID">tt0103064</field>
  </row>
</resultset>
